{
  "schema_version": "0.1",
  "record_status": "provisional_gate0",
  "non_product": true,
  "inventory_id": "G0-STANDARDS-CANONICAL-JSON-FIXTURE",
  "repository": "chasebryan/orange",
  "revision": "f50d35227a04831d459b3358db65b80093e8123a",
  "standards": [
    {
      "standard_id": "G0-STANDARD-RFC-8785",
      "title": "JSON Canonicalization Scheme",
      "issuer": "RFC Editor",
      "document_identifier": "RFC 8785",
      "edition_or_revision": "RFC 8785",
      "publication_date": "2020-06-01",
      "source": {
        "source_class": "primary_publisher",
        "uri": "https://www.rfc-editor.org/rfc/rfc8785.txt",
        "retrieved_at": "2026-07-11T12:00:00Z",
        "digest": {
          "algorithm": "sha256",
          "value": "aaaaaaaaaaaaaaaaaaaaaaaaaaaaaaaaaaaaaaaaaaaaaaaaaaaaaaaaaaaaaaaa"
        },
        "archive_state": "acquisition_required",
        "acquisition_instructions": "Fetch this exact RFC Editor resource during the capture phase and require the synthetic fixture digest to be replaced by its verified digest."
      },
      "rights": {
        "redistribution_status": "unknown",
        "terms_reference": "https://www.rfc-editor.org/copyright/",
        "review_status": "reviewed",
        "review_reference": "Synthetic conformance review reference; not a legal determination."
      },
      "errata": [],
      "normative_clauses": [
        {
          "clause_id": "RFC8785-SECTION-3.2",
          "locator": "Section 3.2, Generation of Canonical JSON Data",
          "relevance": "Defines the provisional Gate 0 canonical serialization used before hashing JSON evidence records.",
          "transcription": {
            "path": "docs/REPRODUCIBILITY.md",
            "digest": {
              "algorithm": "sha256",
              "value": "bbbbbbbbbbbbbbbbbbbbbbbbbbbbbbbbbbbbbbbbbbbbbbbbbbbbbbbbbbbbbbbb"
            },
            "review_state": "independent_review",
            "reviewers": [
              "Independent Fixture Reviewer A",
              "Independent Fixture Reviewer B"
            ]
          }
        }
      ],
      "vector_sources": [],
      "patent_review": {
        "status": "not_reviewed",
        "note": "The fixture makes no patent determination."
      },
      "export_review": {
        "status": "not_reviewed",
        "note": "The fixture makes no export-control determination."
      },
      "technical_review": {
        "status": "independent_review",
        "reviewers": [
          "Independent Fixture Reviewer A",
          "Independent Fixture Reviewer B"
        ],
        "note": "Synthetic reviewer identities exercise record shape and do not establish an actual review."
      }
    }
  ],
  "limitations": [
    "This fixture demonstrates provenance shape; its digest and retrieval time are synthetic and are not a verified standards acquisition.",
    "No future Orange product format is selected by this provisional canonicalization example.",
    "All review identities and references in this fixture are synthetic and do not constitute legal or technical review."
  ]
}
